{
  "atlas": {
    "cell": 128,
    "file": "icons/atlas.02b8d85c.webp",
    "height": 768,
    "width": 768
  },
  "generatedAt": "2026-10-31T05:24:57.930Z",
  "glyphAtlas": {
    "cell": 128,
    "file": "icons/glyph-atlas.85619065.webp",
    "height": 256,
    "width": 384
  },
  "glyphSprite": {
    "file": "icons/glyphs.f3066055.svg"
  },
  "hash": "060cb136",
  "icons": {
    "alt": {
      "checkedAt": "2026-10-31T05:23:35.595Z",
      "favicon": {
        "x": 0,
        "y": 0
      },
      "glyph": {
        "symbol": "g-alt"
      },
      "hash": "0976f4802cd59f8a1f10e87e7d61af74d22faf3c5355ebea22cc7caf2e49604c",
      "locked": false,
      "palette": null,
      "seed": "1f2e3d4c",
      "shape": "default",
      "sourceTint": [
        "#e36652",
        "#febfb3",
        "#752114"
      ],
      "status": "found",
      "tint": [
        "#e75e63",
        "#febdbb",
        "#781821"
      ]
    },
    "criteria-builder--meridian": {
      "checkedAt": "2026-10-31T05:23:35.595Z",
      "favicon": {
        "x": 128,
        "y": 0
      },
      "glyph": {
        "atlas": {
          "x": 0,
          "y": 0
        }
      },
      "hash": "a2ee6180d4334375c01ba3760408301a15b7bfab7be3261fa6ba3ebc89e4fc11",
      "locked": false,
      "palette": null,
      "seed": "1f2e3d4c",
      "shape": "default",
      "sourceTint": [
        "#9989b7",
        "#d6caee",
        "#483962"
      ],
      "status": "found",
      "tint": [
        "#837ba6",
        "#c0bbdb",
        "#352d52"
      ]
    },
    "criteria-builder--rubric": {
      "checkedAt": "2026-10-31T05:23:35.595Z",
      "favicon": {
        "x": 256,
        "y": 0
      },
      "glyph": {
        "symbol": "g-criteria-builder--rubric"
      },
      "hash": "60f94864f922bdc5f99cec9ec9dbd260602d4f48edbe5bca93bd778d73f986af",
      "locked": false,
      "palette": null,
      "seed": "1f2e3d4c",
      "shape": "default",
      "sourceTint": [
        "#9884ce",
        "#d5c8fd",
        "#493375"
      ],
      "status": "found",
      "tint": [
        "#9983d4",
        "#d4ccf0",
        "#4a3278"
      ]
    },
    "dafter": {
      "checkedAt": "2026-10-31T05:23:35.595Z",
      "favicon": {
        "x": 384,
        "y": 0
      },
      "glyph": {
        "symbol": "g-dafter"
      },
      "hash": "21f3ebab2ed72523fad91802fec932e4cb437635fdc6e495b541403b7258a08d",
      "locked": false,
      "palette": null,
      "seed": "1f2e3d4c",
      "shape": "default",
      "status": "found",
      "tint": [
        "#698cf0",
        "#bed0fd",
        "#273c81"
      ]
    },
    "draw": {
      "checkedAt": "2026-10-31T05:23:35.595Z",
      "favicon": {
        "x": 512,
        "y": 0
      },
      "glyph": {
        "symbol": "g-draw"
      },
      "hash": "fb7a6ca202a5b1b9a87d7549f3a92575977669489a75d61848651aaa71bb9247",
      "locked": false,
      "palette": null,
      "seed": "1f2e3d4c",
      "shape": "default",
      "status": "found",
      "tint": [
        "#b45cc9",
        "#f0aef0",
        "#5b1a66"
      ]
    },
    "drug-list--free": {
      "checkedAt": "2026-10-31T05:23:35.595Z",
      "favicon": {
        "x": 640,
        "y": 0
      },
      "glyph": {
        "symbol": "g-drug-list--free"
      },
      "hash": "30f142c87fb0aa2579acccc7ce29a796a69b26afb9104a68e6e57320d77989ec",
      "locked": false,
      "palette": null,
      "seed": "1f2e3d4c",
      "shape": "default",
      "sourceTint": [
        "#de6e39",
        "#ffc1a7",
        "#702900"
      ],
      "status": "found",
      "tint": [
        "#e26c29",
        "#f2c7b4",
        "#6e2c02"
      ]
    },
    "drug-list--full": {
      "checkedAt": "2026-10-31T05:23:35.595Z",
      "favicon": {
        "x": 0,
        "y": 128
      },
      "glyph": {
        "symbol": "g-drug-list--full"
      },
      "hash": "34655de126886eba6de836c226c3f371b9b467906bf49c37a32c1bf55eabb612",
      "locked": false,
      "palette": null,
      "seed": "1f2e3d4c",
      "shape": "default",
      "sourceTint": [
        "#928bba",
        "#d1ccf0",
        "#433b65"
      ],
      "status": "found",
      "tint": [
        "#908abd",
        "#cfcbf2",
        "#413a66"
      ]
    },
    "entity-tracker": {
      "checkedAt": "2026-10-31T05:23:35.595Z",
      "favicon": {
        "x": 128,
        "y": 128
      },
      "glyph": {
        "symbol": "g-entity-tracker"
      },
      "hash": "9e5f4e2b8410ecf6ad36bf1da309e6fb82fdd682326c314838cdbd7492c69473",
      "locked": false,
      "palette": null,
      "seed": "1f2e3d4c",
      "shape": "default",
      "sourceTint": [
        "#569db6",
        "#a6daee",
        "#014a5d"
      ],
      "status": "found",
      "tint": [
        "#5992b0",
        "#a5cfe6",
        "#0d4157"
      ]
    },
    "harvest": {
      "checkedAt": "2026-10-31T05:23:35.595Z",
      "favicon": {
        "x": 512,
        "y": 512
      },
      "glyph": {
        "symbol": "g-studio"
      },
      "hash": "51513be39b2d5412a3e21f6dc0a4024619d2db6e6d2ae3de012d93c55e8f3700",
      "locked": false,
      "palette": null,
      "seed": "1f2e3d4c",
      "shape": "default",
      "sourceTint": [
        "#de6e2c",
        "#fec2a4",
        "#6d2c00"
      ],
      "status": "found",
      "tint": [
        "#c06508",
        "#e7b28c",
        "#4f2704"
      ]
    },
    "id-dates--contacts": {
      "checkedAt": "2026-10-31T05:23:35.595Z",
      "favicon": {
        "x": 256,
        "y": 128
      },
      "glyph": {
        "symbol": "g-id-dates--contacts"
      },
      "hash": "da73c74da06a3988157336bffeaae60651966dfc45a630a38a9047dc7b47753e",
      "locked": false,
      "palette": null,
      "seed": "1f2e3d4c",
      "shape": "default",
      "sourceTint": [
        "#e3674b",
        "#fec0b1",
        "#75220e"
      ],
      "status": "found",
      "tint": [
        "#d05a2d",
        "#ecb19c",
        "#5e1e02"
      ]
    },
    "id-dates--id": {
      "checkedAt": "2026-10-31T05:23:35.595Z",
      "favicon": {
        "x": 384,
        "y": 128
      },
      "glyph": {
        "symbol": "g-id-dates--id"
      },
      "hash": "1d91b6211bd3749cc5bcac1c93978e8e9e25231b3dceeb66fed47cf0e0919e0b",
      "locked": false,
      "palette": null,
      "seed": "1f2e3d4c",
      "shape": "default",
      "sourceTint": [
        "#cc7b49",
        "#fdc3a2",
        "#693005"
      ],
      "status": "found",
      "tint": [
        "#c17c40",
        "#f3c39d",
        "#5f3203"
      ]
    },
    "index-builder": {
      "checkedAt": "2026-10-31T05:23:35.595Z",
      "favicon": {
        "x": 512,
        "y": 128
      },
      "glyph": {
        "symbol": "g-index-builder"
      },
      "hash": "499b1490f8e1815a88c92d4b4926822db70024fd5730008eeb90067a60f234a3",
      "locked": false,
      "palette": null,
      "seed": "1f2e3d4c",
      "shape": "default",
      "sourceTint": [
        "#6b9f8f",
        "#b4dbce",
        "#184d3f"
      ],
      "status": "found",
      "tint": [
        "#689884",
        "#afd4c4",
        "#164736"
      ]
    },
    "ledger-form--folio": {
      "checkedAt": "2026-10-31T05:23:35.595Z",
      "favicon": {
        "x": 640,
        "y": 128
      },
      "glyph": {
        "atlas": {
          "x": 128,
          "y": 0
        }
      },
      "hash": "f694dcac0028175dafc943a7d3dac3bdb01b7844bb95f50bc677d07d79e42dde",
      "locked": false,
      "palette": null,
      "seed": "1f2e3d4c",
      "shape": "default",
      "status": "found",
      "tint": [
        "#707a8c",
        "#7c9bff",
        "#1c2f8f"
      ]
    },
    "ledger-form--tally": {
      "checkedAt": "2026-10-31T05:23:35.595Z",
      "favicon": {
        "x": 0,
        "y": 256
      },
      "glyph": {
        "symbol": "g-ledger-form--tally"
      },
      "hash": "62c3b624a8ebcb1aba7645127ef527360b25cac63c06ec69452944b63d037c3b",
      "locked": false,
      "palette": null,
      "seed": "1f2e3d4c",
      "shape": "default",
      "sourceTint": [
        "#d77250",
        "#fdc1ad",
        "#742302"
      ],
      "status": "found",
      "tint": [
        "#d37059",
        "#f0c2b7",
        "#702111"
      ]
    },
    "paid-calculator--calc": {
      "checkedAt": "2026-10-31T05:23:35.595Z",
      "favicon": {
        "x": 128,
        "y": 256
      },
      "glyph": {
        "symbol": "g-paid-calculator--calc"
      },
      "hash": "441aa434f3ea89bc8c4b0dcb51978d2923cb1ab69a12ef853ea3d263a3ea74b3",
      "locked": false,
      "palette": null,
      "seed": "1f2e3d4c",
      "shape": "default",
      "sourceTint": [
        "#8092b8",
        "#c3d1ef",
        "#334263"
      ],
      "status": "found",
      "tint": [
        "#7992b5",
        "#bcd0ec",
        "#2c4160"
      ]
    },
    "paid-calculator--daleel": {
      "checkedAt": "2026-10-31T05:23:35.595Z",
      "favicon": {
        "x": 256,
        "y": 256
      },
      "glyph": {
        "symbol": "g-paid-calculator--daleel"
      },
      "hash": "2ae1357196651fb631280d3414d8a4b38e97e1406429012b485dd4514e291f7d",
      "locked": false,
      "palette": null,
      "seed": "1f2e3d4c",
      "shape": "default",
      "status": "found",
      "tint": [
        "#c96b8b",
        "#ffb3d9",
        "#8a1150"
      ]
    },
    "parser": {
      "checkedAt": "2026-10-31T05:23:35.595Z",
      "favicon": {
        "x": 384,
        "y": 256
      },
      "glyph": {
        "symbol": "g-parser"
      },
      "hash": "7eb7d20c906296d915386dca4a1d143a6fc2053ca1ba7896c4f7c877631b160b",
      "locked": false,
      "palette": null,
      "seed": "1f2e3d4c",
      "shape": "default",
      "sourceTint": [
        "#bc73be",
        "#f4baf4",
        "#612664"
      ],
      "status": "found",
      "tint": [
        "#b574bf",
        "#ebbdf0",
        "#5b2764"
      ]
    },
    "pharmacy-tools--bugvert": {
      "checkedAt": "2026-10-31T05:23:35.595Z",
      "favicon": {
        "x": 512,
        "y": 256
      },